{
  "schema_version": 1,
  "notes": "单一注册表：manifest/候选/ingest 的 maps_to.pages 仅允许引用此处列出的根目录 HTML（不含 404）；lab_factors 集合须与 assets/lab.js 中 id 完全一致。增删页面或因子时请同步本文件并跑 make validate。",
  "pages": [
    "analysis-hub.html",
    "architecture.html",
    "decade-scenes.html",
    "decade-us.html",
    "decade.html",
    "edu-nexus.html",
    "evolution-loop.html",
    "evolution-triad.html",
    "evolvable-architecture.html",
    "index.html",
    "intelligent-evolution.html",
    "lab.html",
    "legacy-all-in-one.html",
    "model.html",
    "maintainer-hub.html",
    "modules-map.html",
    "national-strategy-opinion.html",
    "net-biz-capital.html",
    "nexus.html",
    "past-future.html",
    "risk-geo.html",
    "smart-overhaul.html",
    "social-responsibility-evolution.html",
    "synthesis-extensions.html",
    "synthesis-methods.html",
    "synthesis.html",
    "timeline.html",
    "work-infra-energy.html"
  ],
  "lab_factors": [
    "ai",
    "attention_minors",
    "capital",
    "dual_use_research",
    "enterprise",
    "esg_compute_carbon",
    "geo",
    "gig_multiemployer",
    "global",
    "oss_export",
    "reg",
    "sanction",
    "talent",
    "water_cooling"
  ]
}
